Title,File Name,RT Rating,Rating,Date,Genre,Actors
The Interview,THE INTERVIEW,48%,R,2014,Action Adventure,"James Franco, Seth Rogen, Lizzy Caplan, Randall Park, Diana Bang, Timothy Simons"
The Jerk,THE JERK,84%,R,1979,Comedy,"Steve Martin, Bernadette Peters, Catlin Adams, Mabel King, Richard Ward"
The King's Speech,THE KING'S SPEECH,92%,R,2010,Drama History,"Colin Firth, Geoffrey Rush, Helena Bonham Carter"
The Other Guys,THE OTHER GUYS,60%,PG-13,2010,Comedy Action,"Will Ferrell, Mark Wahlberg, Eva Mendes"
The Polar Express,THE POLAR EXPRESS,63%,G,2004,Christmas Family Fantasy,"Tom Hanks, Michael Jeter, Nona Gaye"
The Producers,THE PRODUCERS,85%,NR,1968,Comedy,"Zero Mostel, Gene Wilder, Dick Shawn, Kenneth Mars, Estelle Winwood, Christopher Hewett"
The Reader,THE READER,79%,R,2008,Drama Romance,"Kate Winslet, Ralph Fiennes, David Kross"
The Replacements,THE REPLACEMENTS,66%,PG-13,2000,Comedy,"Keanu Reeves, Gene Hackman, Orlando Jones"
The Royal Tenenbaums,THE ROYAL TENENBAUMS,89%,R,2001,Comedy Drama,"Gene Hackman, Anjelica Huston, Ben Stiller"
The Santa Clause,THE SANTA CLAUSE - TIM ALLEN,65%,PG,1994,Christmas Comedy Family,"Tim Allen, Judge Reinhold, Wendy Crewson"
The Score,THE SCORE,67%,R,2001,Mystery Thriller,"Robert De Niro, Ed Norton, Angela Bassett"
The Sessions,THE SESSIONS,80%,R,2012,Biography Comedy,"John Hawkes, Helen Hunt, William H Macy"
The Shining,THE SHINING,93%,R,1980,Mystery Thriller,"Jack Nicholson, Shelley Duvall, Danny Lloyd"
The Theory of Everything,THE THEORY OF EVERYTHING,84%,PG-13,2014,Drama Biography,"Eddie Redmayne, Felicity Jones, Emily Watson, David Thewlis, Charlie Cox, Simon Mc Burney"
The Thomas Crown Affair 1968,THE THOMAS CROWN AFFAIR 1968 4GB,74%,R,1968,Drama Romance,"Steve McQueen, Faye Dunaway, Paul Burke, Jack Weston, Biff McGuire, Yaphet Kotto"
The Thomas Crown Affair 1999,THE THOMAS CROWN AFFAIR 1999 4GB,77%,R,1999,Drama Crime,"Pierce Brosnan Renee Russo, Denis Leary, Ben Gazzara"
The Visitor (Low-Def),THE VISITOR 4GB,84%,PG-13,2007,Drama,"Richard Jenkins, Hiam Abbass, Haaz Sleiman, Danai Gurira"
The Watch,THE WATCH,39%,R,2012,Comedy Sci-fi,"Ben Stiller, Vince Vaughn, Jonah Hill"
The Way,THE WAY,83%,PG-13,2010,Drama,"Martin Sheen, Emilio Estevez, James Nesbitt"
The Weatherman,THE WEATHERMAN,56%,R,2005,Comedy Drama,"Nicolas Cage, Michael Caine, Hope Davis"
The Whole Nine Yards,THE WHOLE NINE YARDS 4GB,64%,R,2000,Comedy,"Bruce Willis, Matthew Perry, Rosana Arquette, Michael Clarke Duncan, Natasha Henstridge, Amanda Peet"
The World Wars D1,THE WORLD WARS D1,79%,TV-14,2014,"TV Series, Documentary, War","Maximilian Klas, Jacopo Rampini, Nabil Vinas, Don Meehan, Don Hartman, Ian Beyts, Jonathan Hartman, Dean Gosdin, Hugh Scully, Joseph Barbarino"
The World Wars D2,THE WORLD WARS D2,79%,TV-14,2014,"TV Series, Documentary, War","Maximilian Klas, Jacopo Rampini, Nabil Vinas, Don Meehan, Don Hartman, Ian Beyts, Jonathan Hartman, Dean Gosdin, Hugh Scully, Joseph Barbarino"
Thelma & Louise,THELMA AND LOUISE,82%,R,1991,Comedy Drama,"Susan Sarandon, Geena Davis, Harvey Keitel"
There's Something About Mary,THERE'S SOMETHING ABOUT MARY,61%,R,1998,Comedy Romance,"Cameron Diaz, Matt Dillon, Ben Stiller"
Three Amigos,THREE AMIGOS 4GB,67%,PG,1986,Comedy,"Steve Martin, Martin Short, Chevy Chase"
Tin Men,TIN MEN,64%,R,1987,Comedy,"Richard Dreyfuss, Danny DeVito, Barbara Hershey"
Tinker Tailor Soldier Spy,TINKER TAILOR SOLDIER SPY,65%,R,2011,Mystery Thriller,"Gary Oldman, Kathy Burke, Benedict Cumberbatch, David Dencik, Colin Firth, Stephen Graham"
To Kill A Mockingbird,TO KILL A MOCKINGBIRD,92%,NR,1962,Drama,"Gregory Peck, Mary Badham, Phillip Alford"
Tootsie,TOOTSIE,81%,PG,1982,Comedy,"Dustin Hoffman, Jessica Lange, Terri Garr, Dabney Coleman, Bill Murray, Charles Durning"
Tower Heist,TOWER HEIST,48%,PG-13,2011,Comedy Adventure,"Ben Stiller, Eddie Murphy, Casey Affleck"
Trading Places,TRADING PLACES,84%,R,1983,Comedy,"Dan Aykroyd, Eddie Murphy, Ralph Bellamy"
Trainwreck,TRAINWRECK,66%,R,2015,Comedy,"Amy Schumer, Bill Hader, Brie Larson"
Transformers,TRANSFORMERS,85%,PG-13,2007,Adventure Sci-fi,"Shia LaBeouf, Tyrese Gibson, Josh Duhamel, Anthony Anderson"
Transformers - Age of Extinction,TRANSFORMERS - AGE OF EXTINCTION,50%,PG-13,2014,Adventure Sci-fi,"Mark Wahlberg, Stanley Tucci, Li Bingbing"
Transformers - Revenge of the Fallen,TRANSFORMERS - REVENGE OF THE FALLEN,57%,PG-13,2009,Adventure Sci-fi,"Shia LaBeouf, Megan Fox, Josh Duhamel, Tyrese Gibson"
Tropic Thunder,TROPIC THUNDER,70%,R,2008,Comedy Action,"Ben Stiller, Jack Black, Robert Downey Jr"
Trouble with the Curve,TROUBLE WITH THE CURVE,66%,PG-13,2012,Drama,"Clint Eastwood, Amy Adams, Justin Timberlake"
Truman Show,TRUMAN 4GB,89%,PG,1998,Comedy Drama,"Jim Carrey, Laura Linney, Noah Emmerich, Natascha McElhone"
Turner And Hooch,TURNER AND HOOCH,51%,PG,1989,Comedy Drama,"Tom Hanks, Mare Winninghan, Craig T Nelson"
Unbroken,UNBROKEN,70%,PG-13,2014,Drama History,"Jack O'Connell, Domhnall, Gleeson, Garrett Hedlund"
Uncle Buck,UNCLE BUCK + GREAT OUTDOORS,76%,PG,1989,Comedy,"John Candy, Amy Madigan, Jean Louisa Kelly"
Under The Tuscan Sun,UNDER THE TUSCAN SUN,78%,PG-13,2003,Comedy Romance,"Diane Lane, Sandra Oh, Lindsay Duncan"
Vacation (National Lampoon's),VACATION,93%,R,1983,Comedy,"Chevy Chase, Beverly D'Angelo, Christie Brinkley, Anthony Michael Hall, Randy Quaid"
Van Wilder,VAN WILDER,73%,R,2002,Comedy,"Ryan Reynolds, Tara Reid, Tim Matheson"
Vegas Vacation (National Lampoon's),VEGAS VACATION 4GB,51%,PG,1997,Comedy,"Chevy Chase, Beverly D'Angelo, Randy Quaid"
Vice,VICE,60%,R,2018,Drama Biography,"Christian Bale, Amy Adams, Steve Carell"
W,W,42%,PG-13,2008,Comedy Drama,"Josh Brolin, Elizabeth Banks, Ellen Burstyn, James Cromwell, Toby Jones, Richard Dreyfuss"
Wagons East!,WAGONS EAST 4GB,32%,PG-13,1994,Comedy Western,"John Candy, Richard Lewis, John C McGinley, Ellen Greene"
Waiting for Guffman,WAITING FOR GUFFMAN 4GB,91%,R,1996,Comedy,"Christopher Guest, Eugene Levy, Fred Willard"
Waitress,WAITRESS,74%,PG-13,2007,Comedy Drama,"Keri Russell, Nathan Fillion, Cheryl Hines"
Waking Ned Devine,WAKING NED DEVINE,88%,PG,1998,Comedy,"Ian Bannen, David Kelly, Fionnula Flanagan, Susan Lynch, James Nesbitt"
Walk Hard - The Dewey Cox Story,WALK HARD - THE DEWEY COX STORY,57%,R,2007,Comedy,"John C Reilly, Jenna Fischer, Raymond J Barry"
Walk the Line,WALK THE LINE,90%,PG-13,2005,Drama Biography,"Joaquin Phoenix, Reese Witherspoon, Ginnifer Goodwin"
Wall Street,WALL STREET,81%,R,1987,Drama,"Michael Douglas, Charlie Sheen, Martin Sheen"
Wall Street: Money Never Sleeps,WALL STREET MONEY NEVER SLEEPS,44%,PG-13,2010,Drama,"Michael Douglas, Shia laBeouf, Josh Brolin, Carey Mulligan, Eli Wallach, Susan Sarandon"
War for the Planet of the Apes,WAR FOR PLANET OF THE APES,84%,PG-13,2017,Action Adventure,"Andy Serkis, Woody Harrelso, Steve Zahn"
War Horse,WAR HORSE,74%,PG-13,2011,Drama War,"Emily Watson, David Thewlis, Jeremy Irvine"
Waterboy,WATERBOY 4GB,71%,PG-13,1998,Comedy,"Adam Sandler, Kathy Bates, Henry Winkler, Fairuza Bulk, Jerry Reed"
We Are Marshall,WE ARE MARSHALL,79%,PG,2006,Drama,"Matthew McConaughhey, Matthew Fox, Ian McShane, Anthony Mackie, Kate Mara, David Strathairn"
We Were Soldiers,WE WERE SOLDIERS,84%,R,2002,Drama War,"Mel Gibson, Madeleine Stowe, Greg Kinnear"
Wedding Crashers,WEDDING CRASHERS,70%,R,2005,Comedy,"Owen Wilson, Vince Vaughn, Christopher Walken, Rachel McAdams, Isla Fisher, Jane Seymour, Keir O'Donnell, Bradley Cooper, Henry Gibson"
Wedding Singer,WEDDING SINGER 4GB,80%,PG-13,1998,Comedy Romance,"Adam Sandler, Drew Barrymore, Christine Taylor"
What About Bob?,WHAT ABOUT BOB 4GB,79%,PG,1991,Comedy,"Bill Murray. Richard Dreyfuss, Julie Hagerty, Charlie Korsmo, Kathryn Erbe, Tom Aldredge"
Whiplash,WHIPLASH,94%,R,2014,Drama Music,"Miles Teller, JK Simmons, Melissa Benoist"
White Christmas,WHITE CHRISTMAS,88%,NR,1954,Christmas Comedy Family,"Bing Crosby, Danny Kaye, Rosemary Clooney"
White House Down,WHITE HOUSE DOWN,62%,PG-13,2013,Action Mystery,"Channing Tatum, Jamie Fox, Maggie Gyllenhaal"
Wild Hogs,WILD HOGS,61%,PG-13,2007,Comedy,"Tim Allen, John Travolta, Martin Lawrence"
Win Win,WIN WIN,85%,R,2011,Comedy Drama,"Paul Giamatti, Amy Ryan, Bobby Cannavale"
You Don't Mess with the Zohan,YOU DON'T MESS WITH THE ZOHAN,45%,PG-13,2008,Comedy,"Adam Sandler, John Turturro, Emmanuelle Chriqui"
"You, Me and Dupree","YOU, ME AND DUPREE",50%,PG-13,2006,Comedy,"Owen Wilson, Kate Hudson, Matt Dillion"
Young Frankenstein,YOUNG FRANKENSTEIN,92%,PG,1974,Comedy,"Gene Wilder, Peter Boyle, Cloris Leachman, Marty Feldman, Madeline Kahn, Teri Garr"
You're Welcome America,YOU'RE WELCOME AMERICA,62%,NR,2009,Comedy,"Will Ferrell, Michael Delaney, Pia Glen"
You've Got Mail,YOU'VE GOT MAIL 4GB,73%,PG,1998,Comedy Romance,"Tom Hanks, Meg Ryan, Parker Posey"
Zach Galifianakis: Live at the Purple Onion,ZACH GALIFIANAKIS 4GB,76%,NR,2007,Stand-up Comedy,"Zach Galifianakis, Owen Wilson, Kristen Wiig"
Zoolander,ZOOLANDER,80%,PG-13,2001,Comedy,"Ben Stiller, Owen Wilson, Will Ferrell"
Zoolander 2,ZOOLANDER 2,20%,PG-13,2016,Comedy,"Ben Stiller, Owen Wilson, Will Ferrell"
