Title,File Name,RT Rating,Rating,Date,Genre,Actors
Isle of Dogs,ISLE OF DOGS,87%,PG-13,2018,Adventure Animation,"Bryan Cranston, Ed Norton, Scarlett Johansson, Bill Murray, Live Schreiber, Jeff Goldblum"
Italian Job 1969,ITALIAN JOB 1969,85%,G,1969,Action Comedy,"Michael Caine, Noel Coward, Benny Hill, Margaret Blye, Tony Beckley, Raf Vallone"
Italian Job 2003,ITALIAN JOB 2003,80%,PG-13,2003,Mystery Thriller,"Mark Wahlberg, Charlize Theron, Ed Norton"
It's a Wonderful Life,ITS A WONDERFUL LIFE,95%,NR,1946,Christmas Drama Family,"James Stewart, Donna Reed, Lionel Barrymore"
J Edgar,J EDGAR,44%,R,2011,Drama Biography,"Leonardo DiCaprio, Naomi Watts, Armie Hammer"
Jim Gaffigan - Beyond The Pale,JIM GAFFIGAN - BEYOND THE PALE,NR,NR,2005,Stand-up Comedy,Jim Gaffigan
Jim Gaffigan - King Baby,JIM GAFFIGAN - KING BABY,87%,NR,2008,Stand-up Comedy,Jim Gaffigan
Joe Dirt,JOE DIRT,63%,PG-13,2001,Comedy,"David Spade, Dennis Miller, Brittany Daniel"
Joker,JOKER,88%,R,2019,Drama Crime,"Joaquin Phoenix, Robert De Niro, Zazie Beetz"
Joy,JOY,57%,PG-13,2015,Comedy Drama,"Robert De Niro, Jennifer Lawrence, Edgar Ramirez, Diane Ladd"
Judy,JUDY,85%,PG-13,2019,Drama Biography,"Renee Zellweger, Jessie Buckley, Finn Wittrock"
Jurassic Park,JURASSIC PARK,91%,PG-13,1993,Sci-fi Mystery Thriller,"Sam Neill, Laura Dern, Jeff Goldblum, Richard Attenborough, Bob Peck, Martin Ferrero"
Just Like Heaven,JUST LIKE HEAVEN,75%,PG-13,2005,Comedy Romance,"Reese Witherspoon, Mark Ruffalo, Donal Logue"
Karate Kid,KARATE KID,82%,PG,1984,Drama,"Ralph Macchio, Pat Morita, Elisabeth Shue"
Kicking and Screaming,KICKING AND SCREAMING,43%,PG,2005,Comedy,"Will Ferrell, Robert Duvall, Mike Ditka"
Killing Lincoln,KILLING LINCOLN,61%,TV14,2013,Drama,"Bill Campbell, Jesse Johnson, Geraldine Hughes"
Knives Out,KNIVES OUT,92%,PG-13,2019,Drama Crime,"Daniel Craig, Chris Evans, Ana de Armas"
Knocked Up,KNOCKED UP,89%,R,2007,Comedy Romance,"Seth Rogen, Katherine Heigl, Paul Rudd"
K-PAX,KPAX,75%,PG-13,2001,Drama Sci-fi,"Kevin Spacey, Jeff Bridges, Mary McCormack"
L.A. Story,LA STORY,75%,PG-13,1991,Comedy Romance,"Steve Martin, Victoria Tennant, Richard E Grant, Marilu Henner, Sarah Jessica Parker"
Lee Daniels' The Butler,LEE DANIELS THE BUTLER,78%,PG-13,2013,Drama History,"Forest Whitaker, Oprah Winfrey, John Cusack, Jane Fonda,"
Levity,LEVITY,47%,R,2003,Drama,"Billy Bob Thornton, Morgan Freeman, Holly Hunter, Kirsten Dunst"
Liar Liar,LIAR LIAR,75%,PG-13,1997,Comedy,"Jim Carrey, Maura Tierney, Jennifer Tilly"
Liberty Heights (Low-Def),LIBERTY HEIGHTS 4GB LOW-DEF,76%,R,1999,Comedy Drama,"Adrien Brody, Ben Foster, Olando Jones"
Life Aquatic with Steve Zissou,LIFE AQUATIC,82%,R,2004,Comedy,"Bill Murray, Owen Wilson, Cate Blanchett, Anjelica Huston, Willem Dafoe, Jeff Goldblum"
Lincoln,LINCOLN,81%,PG-13,2012,Biography History,"Daniel Day-Lewis, Sally Field, David Strathairn"
Lion,LION,91%,PG-13,2016,Drama Biography,"Dev Patel, Rooney Mara, David Wenham"
Little Miss Sunshine,LITTLE MISS SUNSHINE 4GB,91%,R,2006,Comedy Drama,"Greg Kinnear, Steve Carell, Toni Collette, Alan Arkin, Abigail Breslin, Paul Dano"
Little Shop of Horrors,LITTLE SHOP OF HORRORS 4GB,79%,PG-13,1986,Comedy Musical,"Rick Moranis, Ellen Greene, Steve Martin"
Longest Yard,LONGEST YARD,62%,PG-13,2005,Comedy,"Adam Sandler, Chris Rock, Burt Reynolds"
Looper,LOOPER,82%,R,2012,Action Sci-fi,"Bruce Willlis, Joseph Gordon-Levitt, Emily Blunt"
Major League,MAJOR LEAGUE,84%,R,1989,Comedy,"Charlie Sheen, Tom Berenger, Corbin, Bernsen, Margaret Whitton, James Gammon, Rene Russo"
Man of the Year,MAN OF THE YEAR,45%,PG-13,2006,Comedy,"Robin Williams, Laura Linney, Christopher Walken, Lewis Black, Jeff Goldblum"
Marshall,MARSHALL,84%,PG-13,2017,Biography History,"Chadwick Boseman, Josh Gad, Kate Hudson, Sterling K Brown, Dan Stevens, James Cromwell"
M*A*S*H,MASH,83%,R,1970,War Comedy,"Donald Sutherland, Elliot Gould, Sally Kellerman, Tom Skerritt, Robert Duvall, Jo Ann Pflug"
Mask,MASK,83%,PG-13,1985,Biography Drama,"Eric Stoltz, Cher, Sam Elliott"
Master and Commander,MASTER AND COMMANDER,80%,PG-13,2003,Adventure War,"Russell Crowe, Paul Bettany, Billy Boyd, James D'Arcy, Lee Ingleby, George Innes"
Masterminds,MASTERMINDS,35%,PG-13,2016,Comedy Action,"Zach Galifianakis, Owen Wilson, Kristen Wiig"
Matchstick Men,MATCHSTICK MEN,74%,PG-13,2003,Comedy,"Nicolas Cage, Sam Rockwell, Alison Lohman"
Matrix,MATRIX,85%,R,1999,Action Sci-fi,"Keanu Reeves, Laurence Fishburne, Carrie-Anne Moss"
Me Earl and the Dying Girl,ME EARL AND DYING GIRL,86%,PG-13,2015,Comedy Drama,"Thomas Mann, Olivia Cooke, RJ Cyler"
"Me, Myself, and Irene",ME MYSELF AND IRENE,57%,R,2000,Comedy,"Jim Carrey, Renee Zellweger, Chris Cooper, Robert Forster"
Meatballs,MEATBALLS 4GB,57%,PG,1979,Comedy,"Bill Murray, Chris Makepeace, Kate Lynch, Harvey Atkin, Kristine DeBell"
Meet The Parents,MEET THE PARENTS 2000,79%,PG-13,2000,Comedy,"Robert De Niro, Ben Stiller,Blythe Danner, Teri Polo"
Meet The Parents - Little Fockers,MEET THE PARENTS - LITTLE FOCKERS 2010,34%,PG-13,2010,Comedy,"Robert De Niro, Ben Stiller, Owen Wilson, Blythe Danner, Dustin Hoffman, Barbra Streisand"
Meet The Parents - Meet The Fockers,MEET THE PARENTS - MEET THE FOCKERS 2004,58%,PG-13,2004,Comedy,"Robert De Niro, Ben Stiller,Blythe Danner, Teri Polo, Dustin Hoffman, Barbra Streisand"
Meet The Patels,MEET THE PATELS 4GB,76%,PG,2014,Comedy Romance,"Ravi Patel, Geeta Patel"
Mickey's Christmas Carol,MICKEYS CHRISTMAS CAROL 4GB,90%,G,1983,Christmas Family Cartoon,NA
Mickey's Twice Upon  a Christmas,MICKEY'S TWICE UPON A CHRISTMAS,61%,G,2004,Christmas Family Cartoon,NA
Miracle on 34th Street (1947),MIRACLE ON 34TH 1947 4GB,87%,NR,1947,Christmas Drama Family,"Maureen O'Hara, John Payne, Edmund Gwenn"
Miracle on 34th Street (1994),MIRACLE ON 34TH 1994,62%,PG,1994,Christmas Drama Family,"Richard Attenborough, Elizabeth Perkins, Dylan Mc Dermott"
Moneyball,MONEYBALL,86%,PG-13,2011,Drama,"Brad Pitt, Jonah Hill, Philip Seymore Hoffman"
Moonrise Kingdom,MOONRISE KINGDOM,86%,PG-13,2012,Comedy Drama,"Bruce Willis, Ed Norton, Bill Murray"
Mr. Mom,MR MOM 4GB,57%,PG,1983,Comedy,"Michael Keaton, Terri Garr, Ann Jillian"
Mrs. Doubtfire,MRS DOUBTFIRE,77%,PG,1993,Comedy Family Kids,"Robin Williams, Sally Field, Pierce Brosnan, Harvey Fierstein, Polly Holliday, Lisa Jakub"
Multiplicity,MULTIPLICITY 4GB,49%,PG-13,1996,Comedy,"Michael Keaton, Andie MacDowell, Harris Yulin"
Must Love Dogs,MUST LOVE DOGS,50%,PG-13,2005,Comedy Romance,"Diane Lane, John Cusask, Elizabeth Perkins"
My Big Fat Greek Wedding,MY BIG FAT GREEK WEDDING,73%,PG,2002,Comedy Romance,"Nia Vardalos, John Corbett, Michael Constantine, Lainie Kazan, Amdrea Martin, Joey Fatone"
My Fellow Americans,MY FELLOW AMERICANS 4GB,64%,PG-13,1996,Comedy Adventure,"Jack lemmon, James Garner, Dan Aykroyd"
National Treasure,NATIONAL TREASURE,76%,PG,2004,Adventure Action,"Nicolas Cage, Jon Voight, Harvey Keitel"
News of the World,NEWS OF THE WORLD,89%,PG-13,2020,Drama Adventure,"Tom Hanks, Helena Zengel, Mare Winningham"
Night at the Museum,NIGHT AT THE MUSEUM 1,67%,PG,2006,Adventure Fantasy,"Ben Stiller, Robin Williams, Amy Adams"
Night at the Museum: Battle of the Smithsonian,NIGHT AT THE MUSEUM 2,47%,PG,2009,Comedy Family Kids,"Ben Stiller, Robin Williams, Amy Adams"
Night Shift,NIGHT SHIFT 4GB,63%,R,1982,Comedy,"Henry Winkler, Michael Keaton, Shelley Long"
Nightcrawler ,NIGHTCRAWLER,86%,R,2014,Drama Crime,"Jake Gyllenhaal, Rene Russo, Bill Paxton, Riz Ahmed, Ann Cusack"
"O Brother, Where Art Thou?",O BROTHER,89%,PG-13,2000,Comedy Drama,"George Clooney, John Turturro, Tim Blake Nelson, John Goodman, Holly Hunter"
Oceans 11 - 1960,OCEANS 11 - 1960,81%,NR,1960,Comedy Drama,"Frank Sinatra, Dean Martin, Sammy Davis Jr"
Oceans 11 - 2001,OCEANS 11 - 2001,80%,PG-13,2001,Crime Comedy,"George Clooney, Matt Damon, Andy Garcia"
Oceans 12,OCEANS 12,60%,PG-13,2004,Crime Comedy,"George Clooney, Matt Damon, Brad Pitt"
Oceans 13,OCEANS 13,75%,PG-13,2007,Comedy Drama,"George Clooney, Matt Damon, Brad Pitt, Andy Garcia, Al Pacino"
Office Space,OFFICE SPACE 4GB,93%,R,1999,Comedy,"Ron Livingston, Jennifer Aniston, David Herman, Ajay Naidu, Diedrich Bader, Stephen Root"
Old School,OLD SCHOOL,86%,R,2003,Comedy,"Luke Wilson, Will Ferrell, Vince Vaughn, Jeremy Piven, Ellen Pompeo, Juliette Lewis, Patrick Cranshaw"
One Flew Over the Cuckoos Nest,ONE FLEW OVER THE CUCKOOS NEST,96%,R,1975,Drama,"Jack Nicholson, Loiuse Flether, Brad Dourif, William Redfield, Michael Berryman"
Only the Brave,ONLY THE BRAVE,91%,PG-13,2017,Drama Adventure,"Josh Brolin, Miles Teller, Jeff Bridges"
Patriot,PATRIOT,81%,R,2000,Drama War,"Mel Gibson, Heath Ledger, Joely Richardson"
Patriots Day,PATRIOTS DAY,86%,R,2016,Mystery Crime,"Mark Wahlberg, Kevin Bacon, John Goodman, J K Simmons, Michelle Monaghan, Michael Beach"
Paul (Low-Def),PAUL 4GB,62%,R,2011,Comedy Adventure,"Simon Pegg, Nick Frost, Seth Rogan, Jason Bateman Kristen Wiig, Bill Hader"
Paul Blart Mall Cop,PAUL BLART MALL COP,43%,PG,2009,Comedy,"Kevin James, Jayma Mays, Keir O'Donnell, Bobby Cannavale"
Paul Blart Mall Cop 2,PAUL BLART MALL COP 2,33%,PG,2015,Comedy,"Kevin James, Raini Rodriguez, Neal McDonough"
Phenomenon,PHENOMENON 4GB,59%,PG,1996,Drama,"John Travolta, Kyra Sedgwick, Forest Whitaker, Jeffrey DeMunn, Robert Duvall"
Philadelphia,PHILADELPHIA 4GB,89%,PG-13,1993,Drama,"Tom Hanks, Denzell Washington, Jason Robards, Antonio Banderas, Joanne Woodward, Mary Steenburgen"
Philomena,PHILOMENA,89%,PG-13,2013,Drama,"Judi Dench, Steve Coogan, Michelle Fairley, Barbara Jefford, Anna Maxwell Martin, Mare Winningham"
Pitch Perfect,PITCH PERFECT 1,83%,PG-13,2012,Comedy Romance,"Anna Kendrick, Rebel Wilson, Skylar Astin"
Pitch Perfect 2,PITCH PERFECT 2,64%,PG-13,2015,Comedy,"Anna Kendrick, Rebel Wilson, Hailee Steinfeld"
Pitch Perfect 3,PITCH PERFECT 3,43%,PG-13,2017,Comedy,"Anna Kendrick, Rebel Wilson, Hailee Steinfeld"
"Planes, Trains and Automobiles",PLANES TRAINS AUTOMOBILES,87%,R,1987,Comedy,"Steve Martin, John Candy, Laila Robins, Michael McKean, Kevin Bacon"
Planet of the Apes,PLANET OF THE APES,87%,G,1968,Adventure Sci-fi,"Charlton Heston, Roddy McDowall, Kim Hunter, Maurice Evans, James Whitmore, James Daley"
Poltergeist,POLTERGEIST,79%,PG,1982,Horror Mystery,"Craig T Nelson, JoBeth Williams, Beatrice Straight"
Proof,PROOF,59%,PG-13,2005,Drama,"Gwyneth Paltrow, Anthony Hopkins, Jake Gyllenhaal"
Pursuit of Happyness,PURSUIT OF HAPPYNESS,87%,PG-13,2006,Drama,"Will Smith, Jaden Smith, Thandie Newton"
Race,RACE,77%,PG-13,2016,Drama Biography,"Stephan James, Jason Sudeikis, Eli Goree, Shanice Banton"
Rain Man,RAIN MAN,90%,R,1988,Comedy Drama,"Dustin Hoffman, Tom Cruise, Valeria Golino"
RAMBO,RAMBO 4GB,69%,R,2008,Adventure Action,"Sylvester Stallone, Julie Benz, Matthew Marsden"
Red Army,RED ARMY,85%,PG,2014,Documentary,"Scotty Bowman, Viacheslav Fetisov, Anatoli Karpov"
Remember the Titans,REMEMBER THE TITANS,93%,PG,2000,Drama,"Denzel Washington, Will Patton, Donald Faison"
RENO911!: Miami,RENO 911 MIAMI THE MOVIE,51%,R,2007,Comedy,"Thomas Lennon, Robert Ben Garant, Kerri Kenney, Cedric Yarbrough, Carlos Alzraqui, Wendy McLendon-Covey"
RENO911!  Season 1 Disk 1,RENO911 S1 D1,75%,TV-14,2003,Comedy,"Cedric Yarbough, Niecy Nash, Robert Ben Garant, Thomas Lennon, Carlos Alazraqui, Wendi McLendon, Kerri Kenney, Joe Lo Truglio"
RENO911!  Season 1 Disk 2,RENO911 S1 D2,75%,TV-14,2003,Comedy,"Cedric Yarbough, Niecy Nash, Robert Ben Garant, Thomas Lennon, Carlos Alazraqui, Wendi McLendon, Kerri Kenney, Joe Lo Truglio"
RENO911!  Season 2 Disk 1,RENO911 S2 D1,75%,TV-14,2004,Comedy,"Cedric Yarbough, Niecy Nash, Robert Ben Garant, Thomas Lennon, Carlos Alazraqui, Wendi McLendon, Kerri Kenney, Joe Lo Truglio"
RENO911!  Season 2 Disk 2,RENO911 S2 D2,75%,TV-14,2004,Comedy,"Cedric Yarbough, Niecy Nash, Robert Ben Garant, Thomas Lennon, Carlos Alazraqui, Wendi McLendon, Kerri Kenney, Joe Lo Truglio"
RENO911!  Season 2 Disk 3,RENO911 S2 D3,75%,TV-14,2004,Comedy,"Cedric Yarbough, Niecy Nash, Robert Ben Garant, Thomas Lennon, Carlos Alazraqui, Wendi McLendon, Kerri Kenney, Joe Lo Truglio"
RENO911!  Season 3 Disk 1,RENO911 S3 D1,75%,TV-14,2005,Comedy,"Cedric Yarbough, Niecy Nash, Robert Ben Garant, Thomas Lennon, Carlos Alazraqui, Wendi McLendon, Kerri Kenney, Joe Lo Truglio"
RENO911!  Season 3 Disk 2,RENO911 S3 D2,75%,TV-14,2005,Comedy,"Cedric Yarbough, Niecy Nash, Robert Ben Garant, Thomas Lennon, Carlos Alazraqui, Wendi McLendon, Kerri Kenney, Joe Lo Truglio"
RENO911!  Season 4 Disk 1,RENO911 S4 D1,75%,TV-14,2006,Comedy,"Cedric Yarbough, Niecy Nash, Robert Ben Garant, Thomas Lennon, Carlos Alazraqui, Wendi McLendon, Kerri Kenney, Joe Lo Truglio"
RENO911!  Season 4 Disk 2,RENO911 S4 D2,75%,TV-14,2006,Comedy,"Cedric Yarbough, Niecy Nash, Robert Ben Garant, Thomas Lennon, Carlos Alazraqui, Wendi McLendon, Kerri Kenney, Joe Lo Truglio"
RENO911!  Season 5 Disk 1,RENO911 S5 D1,75%,TV-14,2008,Comedy,"Cedric Yarbough, Niecy Nash, Robert Ben Garant, Thomas Lennon, Carlos Alazraqui, Wendi McLendon, Kerri Kenney, Joe Lo Truglio"
RENO911!  Season 5 Disk 2,RENO911 S5 D2,75%,TV-14,2008,Comedy,"Cedric Yarbough, Niecy Nash, Robert Ben Garant, Thomas Lennon, Carlos Alazraqui, Wendi McLendon, Kerri Kenney, Joe Lo Truglio"
RENO911!  Season 5 Disk 3,RENO911 S5 D3,75%,TV-14,2008,Comedy,"Cedric Yarbough, Niecy Nash, Robert Ben Garant, Thomas Lennon, Carlos Alazraqui, Wendi McLendon, Kerri Kenney, Joe Lo Truglio"
RENO911!  Season 6 Disk 1,RENO911 S6 D1,75%,TV-14,2009,Comedy,"Cedric Yarbough, Niecy Nash, Robert Ben Garant, Thomas Lennon, Carlos Alazraqui, Wendi McLendon, Kerri Kenney, Joe Lo Truglio"
RENO911!  Season 6 Disk 2,RENO911 S6 D2,75%,TV-14,2009,Comedy,"Cedric Yarbough, Niecy Nash, Robert Ben Garant, Thomas Lennon, Carlos Alazraqui, Wendi McLendon, Kerri Kenney, Joe Lo Truglio"
Revenge of the Nerds,REVENGE OF THE NERDS,73%,R,1984,Comedy,"Robert Carradine, Anthony Edwards, Ted McGinley"
Rise of the Planet of the Apes,RISE OF THE PLANET OF THE APES,77%,PG-13,2011,Action Adventure,"James Franco, Freida Pinto, John Lithgow, Brian Cox, Tom Felton, David Oyelowo"
Road to Perdition,ROAD TO PERDITION,86%,R,2002,Drama Crime,"Tom Hanks, Paul Newman, Jude Law"
ROBOCOP,ROBOCOP 1,84%,R,1987,Action Sci-fi,"Peter Weller, Nancy Allen, Ronny Cox"
ROBOCOP 2,ROBOCOP 2,36%,R,1990,Action Sci-fi,"Peter Weller, Nancy Allen, Dan O'Herlihy, Belinda, Bauer"
ROBOCOP 3,ROBOCOP 3 4GB,15%,R,1993,Action Sci-fi,"Robert John Burke, Nancy Allen, Rip Torn, John Castle"
Rocker,ROCKER,46%,PG-13,2008,Comedy,"Rainn Wilson, Chrstina Applegate, Josh Gad"
Rocketman,ROCKETMAN,88%,R,2019,Drama,"Taron Egerton, Jamie Bell, Richard Madden, Gemma Jones"
ROCKY I,ROCKY I,69%,PG,1976,Drama,"Sylvester Stallone, Talia Shire, Burgess Meredith"
ROCKY II,ROCKY II,82%,PG,1979,Drama,"Sylvester Stallone, Talia Shire, Burgess Meredith"
ROCKY III,ROCKY III 4GB,74%,PG,1982,Drama,"Sylvester Stallone, Mr T, Talie Shire"
ROCKY IV,ROCKY IV 4GB,77%,PG,1985,Drama,"Sylvester Stallone, Talia Shire, Burt Young, Dolph Lundgren, Carl Weathers, Brigitte Nielsen, Tony Burton"
ROCKY - CREED,CREED,89%,PG-13,2015,Drama,"Sylvester Stallone, Michael B Jordan, Tessa Thompson, Phylicia Rashad, Andre Ward, Tony Bellew"
Role Models,ROLE MODELS,74%,R,2008,Comedy,"Seann William Scott, Paul Rudd, Christopher Mintz Plasse"
Roxanne,ROXANNE 4GB,63%,PG,1987,Comedy Romance,"Steve Martin, Daryl Hannah, Rick Rossovich"
Rupolph the Red-Nosed Reindeer,RUDOLPH THE RED-NOSED REINDEER 1964,82%,NR,1964,Christmas Family Cartoon,"Burl Ives, Larry D Mann, Billie Mae Richards"
Rudy,RUDY,90%,PG,1993,Drama,"Sean Astin, Ned Beatty, Charles S Dutton"
Run Fat Boy Run,RUN FAT BOY RUN,64%,PG-13,2007,Comedy Romance,"Simon Pegg, Thaniwe Newton, Hank Azaria, Dylan Moran, Harish Patel"
Runaway Bride,RUNAWAY BRIDE,53%,PG,1999,Comedy Romance,"Julia Roberts, Richard Gere, Joan Cusask"
Runaway Jury,RUNAWAY JURY,75%,PG-13,2003,Drama Mystery,"John Cusack, Gene Hackman, Dustin Hoffman"
Rush,RUSH,88%,R,2013,Action Drama,"Chris Hemsworth, Daniel Bruhl, Olivia Wilde"
RV,RV,45%,PG,2006,Comedy Family Kids,"Robin Williams, Jeff Daniels, Cheryl Hines"
Saturday Night Fever,SATURDAY NIGHT FEVER,71%,R,1977,Drama Music,"John Travolta. Karen Lynn Gorney, Barry Miller"
Saving Mr. Banks,SAVING MR BANKS,84%,PG-13,2013,Comedy Drama,"Emma Thompson, Tom Hanks, Paul Giamatti"
Scent of a Woman,SCENT OF A WOMAN,92%,R,1992,Drama,"Al Pacino, Chris O'Donnell, James Rebhorn"
Schindler's List,SCHINDLER'S LIST,97%,R,1993,Drama History,"Liam Neeson, Ben Kingsley, Ralph Fiennes"
School of Rock,SCHOOL OF ROCK,64%,PG-13,2003,Comedy,"Jack Black, Joan Cusack, Mike White"
Scrooge - A Christmas Carol - Jim Carrey,SCROOGE - A CHRISTMAS CAROL - JIM CARREY - 2010,58%,PG,2010,Christmas Drama Family,"Jim Carrey, Robin Wright Penn, Gary Oldman"
Scrooge by Charles Dickens (1935),SCROOGE 1935,54%,NR,1935,Christmas Drama,"Seymour Hicks, Donald Calthrop, Robert Cochran"
Scrooged,SCROOGED - BILL MURRAY 4GB,71%,PG-13,1988,Christmas Comedy Fantasy,"Bill Murray, Karen Allen, John Forsythe"
Seabiscuit,SEABISCUIT,76%,PG-13,2003,Drama,"Tobey Maguire, Jeff Bridges, Chris Cooper, Elizabeth Banks, Gary Stevens, William H Macy"
Searching for Sugar Man,SEARCHING FOR SUGAR MAN,92%,PG-13,2011,Documentary,"Stephen Segerman, Dennis Coffey, Mike Theodore"
Secret Life of Walter Mitty,SECRET LIFE OF WALTER MITTY,71%,PG,2013,Comedy Fantasy,"Ben Stiller, Kristen Wiig, Shirley MacLaine"
Selma,SELMA,86%,PG-13,2014,Drama History,"David Oyelowo, Tom Wilkinson, Carmen Ejogo, Cuba Gooding Jr"
Serial Mom,SERIAL MOM 4GB,72%,R,1994,Comedy,"Kathleen Turner, Sam Waterston, Ricki Lake"
Shallow Hal,SHALLOW HAL,45%,PG-13,2001,Comedy Romance,"Gwyneth Paltrow, Jack Black, Jason Alexander"
Shanghai Knights,SHANGHAI KNIGHTS,54%,PG-13,2003,Comedy Action,"Jackie Chan, Owen Wilson, Aaron Taylor Johnson"
Shaun of the Dead,SHAUN OF THE DEAD,93%,R,2004,Comedy Horror,"Simon Pegg, Kate Ashfield, Lucy Davis, Nick Frost, Dylan Moran, Bill Nighy"
Shawshank Redemption,SHAWSHANK REDEMPTION,98%,R,1994,Drama,"Tim Robbins, Morgan Freeman, Bob Gunton"
Sideways,SIDEWAYS,78%,R,2004,Comedy Drama,"Paul Giamatti, Thomas Haden Church, Virginia Madsen, Sandra Oh"
Silence of the Lambs,SILENCE OF THE LAMBS,95%,R,1991,Drama Crime,"Jodie Foster, Anthony Hopkins, Scott Glenn Ted Levine"
Silkwood,SILKWOOD,78%,R,1983,Drama,"Meryl Streep, Kurt Russell, Cher, Craig T Nelson"
Silver Linings Playbook,SILVER LININGS PLAYBOOK,86%,R,2012,Comedy Romance,"Bradley Cooper, Jennifer Lawrence, Robert De Niro"
Sister Act,SISTER ACT,65%,PG,1992,Comedy Musical,"Whoopi Goldberg, Maggie Smith, Kathy Najimy, Wendy Makkena, Mary Wickes"
Sixth Sense,SIXTH SENSE,90%,PG-13,1999,Mystery Thriller,"Bruce Willis, Haley Joel Osment, Toni Collette"
Sleepless In Seattle,SLEEPLESS IN SEATTLE,75%,PG,1993,Comedy Romance,"Tom Hanks, Meg Ryan, Bill Pullman"
Smokey and the Bandit,SMOKEY AND THE BANDIT 4GB,84%,PG,1977,Comedy,"Burt Reynolds, Sally Field, Jackie Gleason, Jerry Reed, Mike Henry, Paul Williams"
SNL - Adam Sandler,SNL - ADAM SANDLER 4GB,NR,NR,NR,Stand-up Comedy,Adam Sandler
SNL - Best of TV Funhouse,SNL - BEST OF TV FUNHOUSE,NR,NR,NR,Stand-up Comedy,Various
SNL - Chris Farley,SNL - CHRIS FARLEY 4GB,NR,NR,NR,Stand-up Comedy,Chris Farley
SNL - Commercial Parodies,SNL - COMMERCIAL PARODIES,NR,NR,NR,Stand-up Comedy,Various
SNL - Dana Carvey,SNL - DANA CARVEY,NR,NR,NR,Stand-up Comedy,Dana Carvey
SNL - Mike Myers,SNL - MIKE MYERS 4GB,NR,NR,NR,Stand-up Comedy,Mike Myers
SNL - Steve Martin,SNL - STEVE MARTIN 4GB,NR,NR,NR,Stand-up Comedy,Steve Martin
SNL - The Woman of Saturday Night Live,SNL - THE WOMEN OF SNL,NR,NR,NR,Stand-up Comedy,Various
Something's Gotta Give,SOMETHING'S GOTTA GIVE,69%,PG-13,2003,Comedy Romance,"Jack Nicholson, Diane Keaton, Keanu Reeves"
Sound of Music,SOUND OF MUSIC,91%,G,1965,Musical Family,"Julie Andrews, Christopher Plummer, Eleanor Parker, Richard Haydn"
Southpaw,SOUTHPAW,75%,R,2015,Drama,"Jake Gyllenhaal, Forest Whitaker, Naomie Harris"
Spanglish,SPANGLISH,60%,PG-13,2004,Comedy Drama,"Adam Sandler, Tea Leoni, Paz Vega, Cloris Leachman"
Speed,SPEED,76%,R,1994,Action Mystery,"Keanu Reeves, Dennis Hopper, Sandra Bullock, Joe Morton, Jeff Daniels, Alan Ruck"
Spider-Man,SPIDER-MAN 2002,90%,PG-13,2002,Action Fantasy,"Tobey Maguire, Willem Dafoe, Kirsten Dunst"
Spider-Man 2,SPIDER-MAN 2 2004,93%,PG-13,2004,Action Fantasy,"Tobey Maguire, James Franco, Kirsten Dunst"
Spider-Man 3,SPIDER-MAN 3 2007,63%,PG-13,2007,Action Fantasy,"Tobey Maguire, James Franco, Kirsten Dunst"
Spinal Tap,SPINAL TAP,92%,R,1984,Comedy,"Rob Reiner, Michael McKean, Christopher Guest, Harry Shearer"
Spotlight,SPOTLIGHT,93%,R,2015,Drama,"Michael Keaton, Mark Rufalo,Rachel McAdams"
Spy,SPY,78%,R,2015,Action Comedy,"Melissa McCarthy, Jason Statham, Rose Byrne"
St. Vincent,ST VINCENT,78%,PG-13,2014,Comedy Drama,"Bill Murray, Melissa McCarthy, Naomi Watts"
Stand By Me,STAND BY ME,94%,R,1986,Comedy Drama,"Will Wheaton, River Phoenix, Corey Feldman"
Star Wars: Episode I - The Phanton Menace ,STAR WARS I - THE PHANTOM MENACE,59%,PG,1999,Action Fantasy,"Liam Neeson, Ewan McGregor, Natalie Portman, Jake Lloyd"
Star Wars: Episode II - Attack of the Clones,STAR WARS II - ATTACK OF THE CLONES,56%,PG,2002,Action Fantasy,"Ewan McGregor, Natalie Portman, Hayden Christensen, Christopher Lee, Samuel L Jackson, Frank Oz"
Star Wars: Episode III - Revenge of the Sith,STAR WARS III - REVENGE OF THE SITH,66%,PG-13,2005,Action Fantasy,"Ewan McGregor, Natalie Portman, Hayden Christensen, Christopher Lee, Samuel L Jackson, Ian McDiarmid"
Star Wars: Episode IV - A New Hope,STAR WARS IV - A NEW HOPE,96%,PG,1977,Action Fantasy,"Mark Hamil, Harrison Ford, Carrie Fisher, Alec Guiness, Peter Cushing"
Star Wars: Episode V - The Empire Strikes Back,STAR WARS V - THE EMPIRE STRIKES BACK,97%,PG,1980,Action Fantasy,"Mark Hamil, Harrison Ford, Carrie Fisher, Billy Dee Williams, David Prowse"
Star Wars: Episode VI - Return of the Jedi,STAR WARS VI - RETURN OF THE JEDI,94%,PG,1983,Action Fantasy,"Mark Hamil, Harrison Ford, Carrie Fisher, Billy Dee Williams, Peter Mayhew"
Star Wars: Episode VII - The Force Awakens,STAR WARS VII - THE FORCE AWAKENS,85%,PG-13,2015,Adventure Fantasy,"Mark Hamil, Harrison Ford, Carrie Fisher"
Starsky and Hutch,STARSKY AND HUTCH,49%,PG-13,2004,Comedy,"Ben Stiller, Owen Wilson, Snoop Dog"
Steel Magnolias,STEEL MAGNOLIAS,89%,PG,1989,Comedy Drama,"Sally Field, Dolly Parton, Shirley MacLaine, Daryl Hannah, Olympia Dukakis, Julia Roberts"
Step Brothers,STEP BROTHERS,69%,R,2008,Comedy,"Will Ferrell, John C Reilly, Richard Jenkins, Mart Steenburgen, Adam Scott, Kathryn Hahn"
Sting,STING,95%,PG,1973,Comedy Drama,"Robert Redford, Paul Newman, Robert Shaw"
Strange Brew,STRANGE BREW 4GB,81%,PG,1983,Comedy,"Dave Thomas, Rick Moranis, Max von Sydow"
Stripes,STRIPES,88%,R,1981,Comedy,"Bill Murray, Harold Ramis, Warren Oates"
Suffragette,SUFFRAGETTE,68%,PG-13,2015,Drama Biography,"Carey Mulligan, Helena Bonham Carter, Brenda Gleeson"
Sully,SULLY,84%,PG-13,2016,Drama Biography,"Tom Hanks, Aaron Eckhart, Valerie Mahaffey"
Super 8 (Low-Def) cp,SUPER 8 4GB LOW-DEF CP,75%,PG-13,2011,Mystery Thriller,"Kyle Chandler, Elle Fanning, Joel Courtney"
Super Troopers,SUPER TROOPERS,90%,R,2001,Comedy,"Jay Chandrasekhai, Kevin Heffernan, Steve Lemme, Paul Soter, Erik Stolhanske, Brian Cox"
Superman: The Movie,SUPERMAN - THE MOVIE,86%,PG,1978,Action Adventure,"Christopher Reeve, Gene Hackman, Marlon Brando, Margot Kidder, Ned Beatty"
Superman II,SUPERMAN II,76%,PG,1980,Adventure Fantasy,"Christopher Reeve, Gene Hackman, Margot Kidder, Ned Beatty"
Swordfish,SWORDFISH,59%,R,2001,Mystery Thriller,"John Travolta, Hugh Jackman, Halle Berry"
Talladega Nights,TALLADEGA NIGHTS,73%,PG-13,2006,Comedy,"Will Ferrell, John C Reilly, Sacha Baron Cohen"
Tenacious D - The Pick of Destiny,TENACIOUS D - THE PICK OF DESTINY,67%,R,2006,Comedy,"Jack Black,Kyle Gass, JR Reed, Tim Robbins, Ben Stiller"
Terminal,TERMINAL,74%,PG-13,2004,Comedy Drama,"Tom Hanks, Catherine Zeta-Jones, Stanley Tucci"
Terms of Endearment,TERMS OF ENDEARMENT,83%,PG,1983,Comedy Drama,"Shirley MacLaine, Debra Winger, Jack Nicholson"
Terri,TERRI,60%,R,2011,Comedy Drama,"Jacob Wysocki, John C Reilly, Creed Bratton"
The Big Bounce,THE BIG BOUNCE,24%,PG-13,2004,Comedy Drama,"Owen Wilson, Morgan Freeman, Gary Sinise"
The Big Short,THE BIG SHORT,88%,R,2015,Comedy Drama,"Steve Carrell, Ryan Gosling, Christian Bale, Brad Pitt, Marisa Tomei, Hamish Linklater"
The Big Year,THE BIG YEAR,41%,PG,2001,Comedy,"Steve Martin, Jack Black, Owen Wilson"
The Birdcage,THE BIRDCAGE 4GB,81%,R,1996,Comedy,"Robin Williams, Gene Hackman, Nathan Lane, Dianne West, Hank Azaria, Christine Baranski"
The Cable Guy,THE CABLE GUY 4GB,51%,PG-13,1996,Comedy,"Jim Carrey, Mathew Broderick, Leslie Mann, Jack Black, George Segal, Diane Baker"
The Campaign,THE CAMPAIGN,51%,R,2012,Comedy,"Will Ferrell, Zach Galifianakis, Ioana Chitu"
The Conspirator,THE CONSPIRATOR,62%,PG-13,2010,Mystery Thriller,"James McAvoy, Robin Wright, Kevin Kline, Evan Rachel Wood, Danny Huston, Tom Wilkinson"
The Current War,THE CURRENT WAR,79%,PG-13,2019,Drama Biography,"Benedict Cumberbatch, Michael Shannon Nicholas Hoult"
The Fast and the Furious ( 2001),THE FAST AND THE FURIOUS 2001,74%,PG-13,2001,Adventure Action,"Vin Diesel, Paul Walker, Michelle Rodriguez"
The Fisher King,THE FISHER KING,85%,R,1991,Comedy Drama,"Robin Williams, Jeff Bridges, Amanda Plummer"
The Founder,THE FOUNDER,82%,PG-13,2016,Drama Biography,"Michael Keaton, Nick Offerman, John Carroll Lynch"
The Graduate,THE GRADUATE,90%,PG,1967,Comedy Drama,"Dustin Hoffman, Anne Bancroft, Katharine Ross"
The Help,THE HELP,89%,PG-13,2011,Drama,"Viola Davis, Emma Stone, Bryce Dallas Howard"
The Incredible Hulk,THE INCREDIBLE HULK,70%,PG-13,2008,Sci-fi Fantasy,"Ed Norton, Liv Tyler, Tim Roth, William Hurt"
The Informant,THE INFORMANT,44%,R,2009,Comedy Crime,"Matt Damon, Scott Bakula, Joel McHale"
The Intern,THE INTERN,73%,PG-13,2015,Comedy Drama,"Robert De Niro, Anne Hathaway, Rene Russo"
